{
  "$schema": "https://json-schema.org/draft/2020-12/schema",
  "$id": "https://github.com/PatrikLager/vtt-platform/internal/rules/schema/ability.schema.json",
  "title": "Ability composition (abilities/*.json, format v2)",
  "description": "One usable ability as a format-v2 composition: id/name/usage (plain fields — spec 2026-07-25-format-v2-composition-design.md §3: \"usage stays a plain ability field\") plus a compose list of atom refs + param bindings, flattened into a CompiledPower at load (internal/rules/load.go's loadCompositions + internal/rules/compile.go). This document is the external contract for ruleset authors and is cross-checked against loader behavior by internal/rules/schema_test.go.",
  "type": "object",
  "required": ["id", "name", "usage", "compose"],
  "additionalProperties": false,
  "properties": {
    "id": { "type": "string", "minLength": 1, "description": "At most 128 bytes of UTF-8." },
    "name": { "type": "string", "minLength": 1 },
    "usage": {
      "description": "Either the bare string \"at_will\", or an object spending a declared resource.",
      "oneOf": [
        { "type": "string", "enum": ["at_will"] },
        {
          "type": "object",
          "required": ["limited"],
          "additionalProperties": false,
          "properties": {
            "limited": {
              "type": "object",
              "required": ["resource", "cost"],
              "additionalProperties": false,
              "properties": {
                "resource": { "type": "string", "minLength": 1 },
                "cost": { "type": "integer", "minimum": 0 }
              }
            }
          }
        }
      ]
    },
    "compose": {
      "description": "The ordered list of atom refs + param bindings this ability composes (spec §4). Execution order is derived from the atoms' declared provides/consumes graph, NOT this list's order — list order breaks ties deterministically (and, where tied same-branch outcomes touch the same clamped resource, meaningfully; spec §4).",
      "type": "array",
      "minItems": 1,
      "items": { "$ref": "#/$defs/composeEntry" }
    }
  },
  "$defs": {
    "composeEntry": {
      "type": "object",
      "required": ["atom", "bind"],
      "additionalProperties": false,
      "properties": {
        "atom": {
          "type": "string",
          "minLength": 1,
          "description": "An atom id declared under atoms/."
        },
        "bind": {
          "type": "object",
          "description": "param name -> bound value: an integer for an int-kind param, a string (an expression) for an expr-kind param, or a string (a declared name) for an attribute/resource/defense/condition-kind param. Must bind every param the referenced atom declares, and no others (atom.schema.json's params list)."
        }
      }
    }
  }
}
