{
  "id": "crossbow-shot",
  "name": "Crossbow Shot",
  "usage": "at_will",
  "compose": [
    { "atom": "ranged-delivery", "bind": { "distance": 15, "targets": 1 } },
    { "atom": "weapon-attack-roll", "bind": { "attack_stat": "dex", "prof": 2, "defense": "ac" } },
    { "atom": "weapon-damage", "bind": { "damage_expr": "1d8" } }
  ]
}
